text,format,module,fact_ids,staffel,chars
Stichting Probiblio ontving €15.621.974 van Zuid-Holland. In drie jaar. #Provincies #Overheidsuitgaven #ZuidHolland,concentration,provincie,PROV-TOP-169,no,115
Hoeveel inkoopcontracten had Schiphol Nederland B.V. bij het Rijk? 249. In acht jaar. #Overheidsinkoop #Rijksinkoop #Transparantie,curiosity,inkoop,INKOOP-TOP-023,yes,130
De Haagse Scholen 007 ontving €47.250.564 van de gemeente Den Haag. In vijf jaar. #Gemeentefonds #Gemeenten #DenHaag,scale_shock,gemeente,GEM-TOP-057,no,116
Natuurmonumenten ontving €17.683.736 van Noord-Brabant. In twee jaar. #Provincies #Overheidsuitgaven #NoordBrabant,concentration,provincie,PROV-TOP-143,no,114
Hoeveel ontving Stichting Landschap Overijssel van Overijssel? €45.101.578. In zeven jaar. #Provincies #Overheidsuitgaven #Overijssel #OV,curiosity,provincie,PROV-TOP-054,no,137
Hoeveel ontving Tno Kwaliteit Van Leven van het Rijk? €1.811.532.000. In zeven jaar. #Overheidsuitgaven #Rijksbegroting #Transparantie,curiosity,instrumenten,INSTR-TOP-104,no,134
Ontwerpwerk B.V. had 171 inkoopcontracten bij het Rijk. Categorie: diversen communicatie. In acht jaar. #Overheidsinkoop #Rijksinkoop #Transparantie,concentration,inkoop,INKOOP-TOP-063,yes,148
Hoeveel inkoopcontracten had HaskoningDHV Nederland B.V. bij het Rijk? 152. In acht jaar. #Overheidsinkoop #Rijksinkoop #Transparantie,curiosity,inkoop,INKOOP-TOP-083,yes,134
Cameranu.nl had 139 inkoopcontracten bij het Rijk. Categorie: benodigdheden en hulpmiddelen. In acht jaar. #Overheidsinkoop #Rijksinkoop #Transparantie,concentration,inkoop,INKOOP-TOP-101,yes,151
Hoeveel ontving Immigratie- en Naturalisatiedienst van het Rijk? €2.959.047.000. In vijf jaar. #Overheidsuitgaven #Rijksbegroting #Transparantie,curiosity,instrumenten,INSTR-TOP-062,no,144
Topgeschenken Nederland BV had 21 contracten bij COA. In zeven jaar. #Overheidsuitgaven #Transparantie #OpenData,concentration,publiek,PUB-SRC-130,yes,112
Coöperatieve Vereniging Agrarisch Landschap ontving €30.736.594 van Gelderland. In twee jaar. #Provincies #Overheidsuitgaven #Gelderland,concentration,provincie,PROV-TOP-081,no,136
Kwintes ontving €49.016.802 van de gemeente Amersfoort. In zeven jaar. #Gemeentefonds #Gemeenten #Amersfoort,scale_shock,gemeente,GEM-TOP-054,no,108
Hoeveel ontving Gemeente Apeldoorn van het Rijk? €2.156.102.000. In acht jaar. #Overheidsuitgaven #Rijksbegroting #Transparantie,curiosity,instrumenten,INSTR-TOP-086,no,128
Hoeveel ontving Gebiedscoöperatie It Lege Midden UA van Friesland? €20.203.189. In één jaar. #Provincies #Overheidsuitgaven #Friesland,curiosity,provincie,PROV-TOP-126,no,134
"Leger des Heils Welzijns-en Gezondheidszorg (Groningen): €2.259.736 in 2019, €5.362.225 in 2020. #Gemeentefonds #Gemeenten #Zorg #Welzijn #Groningen",comparison,gemeente,GEM-TOP-190,no,148
Geanonimiseerde ontvanger(s) van Inkomensoverdrachten voor Aanvullende beurs gift (R) ontving €2.216.154.000 via financiële instrumenten. In drie jaar. #Overheidsuitgaven #Rijksbegroting #OV,scale_shock,instrumenten,INSTR-TOP-082,no,190
Gemeente 's-hertogenbosch ontving €1.934.865.000 via financiële instrumenten. In acht jaar. #Overheidsuitgaven #Rijksbegroting #Transparantie,scale_shock,instrumenten,INSTR-TOP-098,no,141
Surplus Welzijn Breda ontving €21.710.041 van de gemeente Breda. In zeven jaar. #Gemeentefonds #Gemeenten #Breda #Welzijn,scale_shock,gemeente,GEM-TOP-141,no,121
Stichting Gemeentemuseum Den Haag ontving €31.019.452 van de gemeente Den Haag. In drie jaar. #Gemeentefonds #Gemeenten #DenHaag #Cultuur,scale_shock,gemeente,GEM-TOP-093,no,137
"Categorie 'Laboratoriummaterialen': 863 leveranciers, 5355 contracten bij het Rijk. #Overheidsinkoop #Rijksinkoop #Transparantie",category_reveal,inkoop,INKOOP-CAT-025,yes,128
"Categorie 'Aanschaf Hardware': 586 leveranciers, 3860 contracten bij het Rijk. #Overheidsinkoop #Rijksinkoop #Transparantie",category_reveal,inkoop,INKOOP-CAT-032,yes,123
Het Nederlandse Rode Kruis had 30 contracten bij COA. In vier jaar. #Overheidsuitgaven #Transparantie #OpenData,concentration,publiek,PUB-TOP-119,yes,111
Gemeente Zoetermeer ontving €1.361.895.000 via financiële instrumenten. In acht jaar. #Overheidsuitgaven #Rijksbegroting #Transparantie,scale_shock,instrumenten,INSTR-TOP-137,no,135
Ministerie van Sociale Zaken en Werkgelegenheid gaf €148.798.000 uit aan soc.lstn/bijdr zvw. In drie jaar. #Overheidsuitgaven #Rijksbegroting #Transparantie,category_reveal,apparaat,APP-KMIN-176,no,156
"Stichting Stedelijk Museum Breda ontving €27.056.982 van de gemeente Breda. Dat is 4,0% van alle uitkeringen. #Gemeentefonds #Gemeenten #Breda #Cultuur",concentration,gemeente,GEM-DOM-047,no,151
Erasmus Universiteit Rotterdam ontving €3.759.318.000 via financiële instrumenten. In negen jaar. #Overheidsuitgaven #Rijksbegroting #Rotterdam #Universiteit,scale_shock,instrumenten,INSTR-TOP-056,no,157
H. Offerein Supermarkt B.V. had 28 contracten bij COA. In zeven jaar. #Overheidsuitgaven #Transparantie #OpenData,concentration,publiek,PUB-TOP-135,yes,113
DPG Media B.V. had 136 inkoopcontracten bij het Rijk. Categorie: diversen communicatie. #Overheidsinkoop #Rijksinkoop #Transparantie,category_reveal,inkoop,INKOOP-TOP-111,yes,132
Uitjesbazen B.V. had 126 inkoopcontracten bij het Rijk. Categorie: representatie voor eigen personeel. #Overheidsinkoop #Rijksinkoop #Transparantie,category_reveal,inkoop,INKOOP-TOP-135,yes,147
"Verdonck, Klooster & Associates B.V. had 171 inkoopcontracten bij het Rijk. Categorie: aan een externe partij uitbestede ict-dienstverlening. In acht jaar. #Overheidsinkoop #Rijksinkoop #Transparantie",concentration,inkoop,INKOOP-TOP-064,yes,200
Stichting ZB Bibliotheek van Zeeland ontving €21.552.841 van Zeeland. In drie jaar. #Provincies #Overheidsuitgaven #Zeeland #Bibliotheken,concentration,provincie,PROV-TOP-113,no,137
"Hoeveel ontving Gebiedscoop Rijn, Vecht en Venen U.A. van Utrecht? €21.265.288. In twee jaar. #Provincies #Overheidsuitgaven #Utrecht",curiosity,provincie,PROV-TOP-114,no,133
Stichting Accessibility had 174 inkoopcontracten bij het Rijk. Categorie: studie en opleiding. In acht jaar. #Overheidsinkoop #Rijksinkoop #Transparantie,concentration,inkoop,INKOOP-TOP-058,yes,153
"Categorie 'DEF specifiek': 4544 leveranciers, 16657 contracten bij het Rijk. #Overheidsinkoop #Rijksinkoop #Transparantie",category_reveal,inkoop,INKOOP-CAT-011,yes,121
Stichting VRIJDAG ontving €27.310.705 van de gemeente Groningen. In acht jaar. #Gemeentefonds #Gemeenten #Groningen,scale_shock,gemeente,GEM-TOP-108,no,115
Stichting Salvage had 21 contracten bij COA. In zeven jaar. #Overheidsuitgaven #Transparantie #OpenData,concentration,publiek,PUB-SRC-128,yes,103
Hoeveel ontving Stichting HCO van Den Haag? €15.904.434. In vier jaar. #Gemeentefonds #Gemeenten #DenHaag,curiosity,gemeente,GEM-TOP-184,no,105
Huis voor de Kunsten Limburg ontving €15.268.476 van Limburg. In zeven jaar. #Provincies #Overheidsuitgaven #Limburg,concentration,provincie,PROV-TOP-172,no,116
"Solvinity had 135 inkoopcontracten bij het Rijk. Categorie: beheer, onderhoud programmatuur & software. In acht jaar. #Overheidsinkoop #Rijksinkoop #Transparantie",concentration,inkoop,INKOOP-TOP-115,yes,162
"Financien gaf €1.576.008.000 uit aan salaris, vakantie en eindejaarsuitkering. In één jaar. #Overheidsuitgaven #Rijksbegroting #Transparantie",category_reveal,apparaat,APP-KMIN-020,no,141
Karwei Burgum had 17 contracten bij COA. In zeven jaar. #Overheidsuitgaven #Transparantie #OpenData,concentration,publiek,PUB-SRC-190,yes,99
Hoeveel ontving RWA (=reg.WSW A'foort) van Amersfoort? €51.679.136. In drie jaar. #Gemeentefonds #Gemeenten #Amersfoort,curiosity,gemeente,GEM-TOP-051,no,119
Jungheinrich Nederland B.V. had 133 inkoopcontracten bij het Rijk. Categorie: wagenpark. In acht jaar. #Overheidsinkoop #Rijksinkoop #Transparantie,concentration,inkoop,INKOOP-TOP-120,yes,147
Hoeveel inkoopcontracten had Munckhof Reizen B.V. bij het Rijk? 149. In acht jaar. #Overheidsinkoop #Rijksinkoop #Transparantie,curiosity,inkoop,INKOOP-TOP-086,yes,127
Stichting Samen Veilig Midden-Nederland ontving €21.617.006 van de gemeente Almere. In drie jaar. #Gemeentefonds #Gemeenten #Almere,scale_shock,gemeente,GEM-TOP-143,no,131
Stichting Stedelijk Museum Amsterdam ontving €108.729.180 van de gemeente Amsterdam. In acht jaar. #Gemeentefonds #Gemeenten #Amsterdam #Cultuur,scale_shock,gemeente,GEM-TOP-009,no,144
Hoeveel ontving Stichting Food Valley van Gelderland? €24.988.500. In vier jaar. #Provincies #Overheidsuitgaven #Gelderland,curiosity,provincie,PROV-TOP-101,no,123
Infrastructuur en Waterstaat gaf €1.097.231.000 uit aan pensioenpremies. In zeven jaar. #Overheidsuitgaven #Rijksbegroting #Transparantie,category_reveal,apparaat,APP-KMIN-032,no,137
Collectief Alblasserwaard/Vijfheerenlanden Co√∂peratieve U.A. ontving €27.891.820 van Zuid-Holland. In drie jaar. #Provincies #Overheidsuitgaven #ZuidHolland,concentration,provincie,PROV-TOP-092,no,157
"Buitenlandse Zaken gaf €422.111.000 uit aan toelagen, toeslagen en vergoedingen. In zeven jaar. #Overheidsuitgaven #Rijksbegroting #Transparantie",category_reveal,apparaat,APP-KMIN-072,no,145
Hoeveel gaf Ministerie van Veiligheid en Justitie uit aan apparaatskosten? €2.193.548.000. #Overheidsuitgaven #Rijksbegroting #Transparantie,curiosity,apparaat,APP-MIN-017,no,140
Gemeente tilburg: €3.326.821.000. Gemeente Eindhoven: €3.324.318.000. Via financiële instrumenten. #Overheidsuitgaven #Rijksbegroting #Eindhoven #Tilburg #OV,comparison,instrumenten,INSTR-TOP-057;INSTR-TOP-058,no,157
Eindhoven Airport N.V. ontving €55.000.000 van de provincie Noord-Brabant. In één jaar. #Provincies #Overheidsuitgaven #Eindhoven #OV #NoordBrabant,scale_shock,provincie,PROV-TOP-038,no,147
Hoeveel ontving Eindhoven van het Rijk? €1.988.744.000. In vier jaar. #Overheidsuitgaven #Rijksbegroting #Eindhoven #OV,curiosity,instrumenten,INSTR-TOP-092,no,119
Zeelandhallen Exploitatie BV had 31 contracten bij COA. In vijf jaar. #Overheidsuitgaven #Zeeland #Transparantie,concentration,publiek,PUB-SRC-053,yes,112
Elan Zuidoost Friesland ontving €17.300.398 van Friesland. In drie jaar. #Provincies #Overheidsuitgaven #Friesland,concentration,provincie,PROV-TOP-148,no,114
Banketbakkerij Boheemen had 177 inkoopcontracten bij het Rijk. Categorie: representatie voor eigen personeel. In acht jaar. #Overheidsinkoop #Rijksinkoop #Transparantie,concentration,inkoop,INKOOP-TOP-053,yes,168
Hoeveel ontving Samen Veilig Midden-Nederland van Amersfoort? €18.802.078. In zeven jaar. #Gemeentefonds #Gemeenten #Amersfoort,curiosity,gemeente,GEM-TOP-160,no,127
Stichting Buurtteam Amsterdam Zuid ontving €24.554.962 van de gemeente Amsterdam. In twee jaar. #Gemeentefonds #Gemeenten #Amsterdam,scale_shock,gemeente,GEM-TOP-125,no,132
Stichting ZB Bibliotheek van Zeeland ontving €21.552.841 van de provincie Zeeland. In drie jaar. #Provincies #Overheidsuitgaven #Zeeland #Bibliotheken,scale_shock,provincie,PROV-TOP-113,no,150
"Ministerie van Landbouw, Natuur en Voedselkwaliteit ontving €40.809.556 van de provincie Gelderland. In één jaar. #Provincies #Overheidsuitgaven #Gelderland",scale_shock,provincie,PROV-TOP-061,no,156
Gemeente Heerhugowaard ontving €16.583.045 van Noord-Holland. In zeven jaar. #Provincies #Overheidsuitgaven #NoordHolland,concentration,provincie,PROV-TOP-157,no,121
Hoeveel ontving Gemeente Groningen van het Rijk? €4.023.396.000. In acht jaar. #Overheidsuitgaven #Rijksbegroting #Groningen,curiosity,instrumenten,INSTR-TOP-053,no,124
Digital Revolution B.V. had 170 inkoopcontracten bij het Rijk. Categorie: benodigdheden en hulpmiddelen. #Overheidsinkoop #Rijksinkoop #Transparantie,category_reveal,inkoop,INKOOP-TOP-066,yes,149
Stichting Woon ontving €59.858.477 van de gemeente Amsterdam. In negen jaar. #Gemeentefonds #Gemeenten #Amsterdam,scale_shock,gemeente,GEM-TOP-039,no,113
Stichting openbaar onderwijs aan de Amstel ontving €24.729.638 van de gemeente Amsterdam. In negen jaar. #Gemeentefonds #Gemeenten #Onderwijs #Amsterdam,scale_shock,gemeente,GEM-TOP-124,no,152
Computacenter had 178 inkoopcontracten bij het Rijk. Categorie: aanschaf hardware. In zeven jaar. #Overheidsinkoop #Rijksinkoop #Transparantie,concentration,inkoop,INKOOP-TOP-051,yes,142
Stichting Carmelcollege ontving €2.627.972.000 via financiële instrumenten. In negen jaar. #Overheidsuitgaven #Rijksbegroting #Transparantie,scale_shock,instrumenten,INSTR-TOP-073,no,140
Financiën gaf €180.652.000 uit aan inrichting gebouwen. In zeven jaar. #Overheidsuitgaven #Rijksbegroting #Transparantie,category_reveal,apparaat,APP-KMIN-148,no,120
"Schoor Stichting De ontving €104.907.389 van de gemeente Almere. Dat is 12,4% van alle uitkeringen. #Gemeentefonds #Gemeenten #Almere",concentration,gemeente,GEM-DOM-008,no,133
Gemeente Apeldoorn ontving €2.156.102.000 via financiële instrumenten. In acht jaar. #Overheidsuitgaven #Rijksbegroting #Transparantie,scale_shock,instrumenten,INSTR-TOP-086,no,134
St. Rozet ontving €49.020.306 van de gemeente Arnhem. In vijf jaar. #Gemeentefonds #Gemeenten #Arnhem,scale_shock,gemeente,GEM-TOP-053,no,101
Hoeveel ontving Coöperatieve Vereniging Súdwestkust UA van Friesland? €19.332.718. In twee jaar. #Provincies #Overheidsuitgaven #Friesland,curiosity,provincie,PROV-TOP-131,no,138
Geanonimiseerde ontvanger(s) van Inkomensoverdrachten voor INK Zorgtoeslag: €7.043.866.000. Rotterdam: €6.696.380.000. Via financiële instrumenten. #Overheidsuitgaven #Rijksbegroting #Rotterdam #Zorg #OV,comparison,instrumenten,INSTR-TOP-030;INSTR-TOP-031,no,203
Hoeveel ontving Stichting Jeugdbescherming Noord/Drenthe van Groningen? €15.643.000. In drie jaar. #Gemeentefonds #Gemeenten #Drenthe #Groningen,curiosity,gemeente,GEM-TOP-187,no,144
Hoeveel ontving Stichting Centram van Amsterdam? €45.967.763. In negen jaar. #Gemeentefonds #Gemeenten #Amsterdam,curiosity,gemeente,GEM-TOP-058,no,113
"SoftwareONE Netherlands B.V. had 240 inkoopcontracten bij het Rijk. Categorie: beheer, onderhoud programmatuur & software. In vier jaar. #Overheidsinkoop #Rijksinkoop #Transparantie",concentration,inkoop,INKOOP-TOP-025,yes,181
"Financien: €3.246.243.000 aan apparaatskosten. Salarissen, huisvesting, ICT en meer. #Overheidsuitgaven #Rijksbegroting #Transparantie",scale_shock,apparaat,APP-MIN-011,no,134
Sportbedrijf Arnhem BV (Arnhem): €95.492.994. Stichting Anton Constandse (Den Haag): €89.844.748. #Gemeentefonds #Gemeenten #DenHaag #Arnhem,comparison,gemeente,GEM-TOP-013;GEM-TOP-015,no,140
Manutan B.V had 33 contracten bij COA. In zeven jaar. #Overheidsuitgaven #Transparantie #OpenData,concentration,publiek,PUB-SRC-043,yes,97
Dienst Uitvoering Onderwijs ontving €1.741.437.000 via financiële instrumenten. In vijf jaar. #Overheidsuitgaven #Rijksbegroting #Onderwijs,scale_shock,instrumenten,INSTR-TOP-108,no,139
Particulier ontving €41.547.065 van Overijssel. In zeven jaar. #Provincies #Overheidsuitgaven #Overijssel,concentration,provincie,PROV-TOP-059,no,105
Dienst Justitiële Inrichtingen (DJI) ontving €2.398.710.000 in 2020 via financiële instrumenten. #Overheidsuitgaven #Rijksbegroting #Transparantie,scale_shock,instrumenten,INSTR-TOP-019,no,146
Hoeveel ontving Stichting SEZO van Amsterdam? €121.303.545. In negen jaar. #Gemeentefonds #Gemeenten #Amsterdam,curiosity,gemeente,GEM-TOP-006,no,111
Museum Catering Den Haag B.V. had 134 inkoopcontracten bij het Rijk. Categorie: representatie voor eigen personeel. In acht jaar. #Overheidsinkoop #Rijksinkoop #DenHaag #Cultuur,concentration,inkoop,INKOOP-TOP-117,yes,177
Centraal Orgaan opvang asielzoekers (COA) ontving €2.547.197.000 in 2023 via financiële instrumenten. #Overheidsuitgaven #Rijksbegroting #COA,scale_shock,instrumenten,INSTR-TOP-049,no,141
"Stichting Doras (Amsterdam): €1.501.437 in 2023, €12.888.610 in 2022. #Gemeentefonds #Gemeenten #Amsterdam",comparison,gemeente,GEM-TOP-038,no,106
Hoeveel ontving Stichting DOCK van Utrecht? €20.611.671. In twee jaar. #Gemeentefonds #Gemeenten #Utrecht,curiosity,gemeente,GEM-TOP-148,no,105
Min. v. Infrastruct. en Milieu ontving €113.660.000 van Noord-Brabant. In één jaar. #Provincies #Overheidsuitgaven #NoordBrabant,concentration,provincie,PROV-TOP-011,no,128
Berenschot B.V. had 196 inkoopcontracten bij het Rijk. Categorie: studie en opleiding. In acht jaar. #Overheidsinkoop #Rijksinkoop #Transparantie,concentration,inkoop,INKOOP-TOP-039,yes,145
Hoeveel ontving River Operations Rotterdam Drechtsteden B.V. van Zuid-Holland? €20.985.786. In drie jaar. #Provincies #Overheidsuitgaven #Rotterdam #ZuidHolland,curiosity,provincie,PROV-TOP-118,no,160
Munckhof Reizen B.V. had 149 inkoopcontracten bij het Rijk. Categorie: reis en verblijfkosten. In acht jaar. #Overheidsinkoop #Rijksinkoop #Transparantie,concentration,inkoop,INKOOP-TOP-086,yes,153
Gemeente Almere: €845.041.603 aan uitkeringen. Gemeente Tilburg: €829.513.634. #Gemeentefonds #Gemeenten #Tilburg,comparison,gemeente,GEM-TOTAL-004;GEM-TOTAL-005,no,113
Hoeveel ontving Stichting VluchtelingenWerk Nederland van Amsterdam? €43.702.371. In negen jaar. #Gemeentefonds #Gemeenten #Amsterdam,curiosity,gemeente,GEM-TOP-061,no,133
Jumbo Supermarkten BV had 52 contracten bij COA. In zeven jaar. #Overheidsuitgaven #Transparantie #OpenData,concentration,publiek,PUB-SRC-013,yes,107
Hoeveel inkoopcontracten had International Card Services B.V. bij het Rijk? 141. In zeven jaar. #Overheidsinkoop #Rijksinkoop #Transparantie,curiosity,inkoop,INKOOP-TOP-097,yes,140
Hoeveel ontving Stichting Welzijn Scheveningen van Den Haag? €31.134.590. In acht jaar. #Gemeentefonds #Gemeenten #Welzijn #DenHaag,curiosity,gemeente,GEM-TOP-092,no,131
"Stichting Jeugdfonds Sport & Cultuur Amsterdam (Amsterdam): €2.150.000 in 2018, €6.046.000 in 2024. #Gemeentefonds #Gemeenten #Amsterdam #Cultuur #Sport",comparison,gemeente,GEM-TOP-119,no,152
Financiën en Nationale Schuld gaf €373.490.000 uit aan sociale lasten enbijdrage zorgverzekeringswet. In één jaar. #Overheidsuitgaven #Rijksbegroting #Zorg,category_reveal,apparaat,APP-KMIN-082,no,155
